{
  "schemaVersion": "subsidy-ledger-transaction.v1",
  "transactionId": "77777777-7777-4777-8777-777777777777",
  "tenantId": "22222222-2222-4222-8222-222222222222",
  "accountId": "88888888-8888-4888-8888-888888888888",
  "personId": "33333333-3333-4333-8333-333333333333",
  "workOrderId": "11111111-1111-4111-8111-111111111111",
  "policyVersionId": "99999999-9999-4999-8999-999999999999",
  "transactionType": "reservation",
  "amountKrw": 90000,
  "occurredAt": "2026-08-12T04:00:00Z",
  "recordedBy": "aaaaaaaa-aaaa-4aaa-8aaa-aaaaaaaaaaaa",
  "reasonCode": "repair_quote_approved",
  "note": null,
  "source": "native",
  "sourceRef": null
}
